{
  "contract_name": "result_overview_v1",
  "schema_version": "1.0.0",
  "overview_adapter_version": "1.0.0",
  "overview_id": "overview_012af093046f88dd38dd",
  "source_result_id": "result_3bf644fdcc2a02dac32a",
  "result_origin": "sanitized_fixture",
  "created_at_utc": "2026-07-14T01:10:18.636710+00:00",
  "campaigns": [
    {
      "campaign_id": "campaign_680a1c703970b736d20e",
      "passport": {
        "campaign_name": "Demo campaign 1",
        "source_campaign_name": "Demo source campaign 1",
        "segments": [
          "SEGMENT_01"
        ],
        "source_start_date": "2026-04-16",
        "source_end_date": "2026-05-15",
        "model_start_date": "2026-04-16",
        "model_end_date": "2026-05-15",
        "source_active_days": 30,
        "model_active_days": 30,
        "source_channels": [
          "CHANNEL_01",
          "CHANNEL_02",
          "CHANNEL_03",
          "CHANNEL_04",
          "CHANNEL_05",
          "CHANNEL_06",
          "CHANNEL_07"
        ],
        "modeled_channels": [
          "CHANNEL_08",
          "CHANNEL_09",
          "CHANNEL_10",
          "CHANNEL_11",
          "CHANNEL_06"
        ],
        "unmodeled_channels": [],
        "geographies": [
          "GEO_01",
          "GEO_02",
          "GEO_03",
          "GEO_04",
          "GEO_05",
          "GEO_06",
          "GEO_07",
          "GEO_08",
          "GEO_09",
          "GEO_10",
          "GEO_11",
          "GEO_12"
        ],
        "creatives": []
      },
      "budget": {
        "uploaded_budget_rub": 27373702.49,
        "model_input_budget_rub": 27373702.49,
        "calculated_budget_rub": 27373702.49,
        "unmodeled_budget_rub": 0.0,
        "unallocated_budget_rub": 0.0,
        "model_coverage_share": 1.0
      },
      "statuses": {
        "calculation_status": {
          "code": "calculated",
          "display_text": "Рассчитано"
        },
        "campaign_scale_status": {
          "code": "between_historical_p99_and_robust_upper",
          "display_text": "Очень крупная, нужна повышенная осторожность"
        },
        "cell_support_status": {
          "code": "between_p95_p99",
          "display_text": "Между p95 и p99"
        },
        "optimizer_status": {
          "code": "best_safe_available",
          "display_text": "Лучший безопасный S6 рассчитан"
        },
        "business_decision_status": {
          "code": "allocation_only",
          "display_text": "Не настроено: нужен бизнес-порог"
        }
      },
      "quality": {
        "status": {
          "code": "elevated_uncertainty",
          "display_text": "Повышенная неопределенность"
        },
        "explanation": "Есть ячейки между historical p95 и p99: расчет допустим, но неопределенность выше обычной.",
        "coverage_share": 1.0,
        "uncertainty_width_share": 0.0479511018428269
      },
      "scenarios": [
        {
          "scenario_id": "S01",
          "name": "Сценарий 1. Как загрузили",
          "description": "Ничего не меняем: бюджет, каналы, гео и даты остаются как в исходной спецификации маркетолога.",
          "available": true,
          "budget": {
            "requested_budget_rub": 27373702.49,
            "allocated_budget_rub": 27373702.49,
            "unallocated_budget_rub": 0.0
          },
          "metrics": {
            "incremental_turnover": {
              "unit": "RUB",
              "p10": 82547005.712748,
              "p50": 84616974.399163,
              "p90": 86605097.909765
            },
            "turnover_roas": {
              "unit": "ratio",
              "p10": 3.015559,
              "p50": 3.091178,
              "p90": 3.163807
            },
            "incremental_orders": {
              "unit": "orders",
              "p10": 2290.290205,
              "p50": 3560.498219,
              "p90": 5357.154497
            },
            "incremental_orders_usage": "diagnostic_only",
            "avg_basket_turnover_bridge": {
              "unit": "turnover_bridge_from_avg_basket_rub",
              "p10": 78156294.905115,
              "p50": 79663232.066932,
              "p90": 81045688.59595
            }
          },
          "calculation_status": {
            "code": "calculated",
            "display_text": "Рассчитано"
          },
          "cell_support_status": {
            "code": "above_robust_upper",
            "display_text": "Вне надежной наблюдаемой зоны"
          },
          "optimizer_status": {
            "code": "no_safe_candidate",
            "display_text": "Только ручное распределение"
          },
          "support": {
            "elevated_warnings": 318,
            "strong_warnings": 1,
            "hard_warnings": 2,
            "policy_violations": 2
          },
          "quality": {
            "status": {
              "code": "not_for_automatic_reallocation",
              "display_text": "Не использовать для автоматического перераспределения"
            },
            "explanation": "Прогноз рассчитан, но хотя бы одна geo x channel ячейка выше robust observed upper. Это не запрет кампании: автоматическое перераспределение блокируется, медиаплан проверяется вручную.",
            "coverage_share": 1.0,
            "uncertainty_width_share": 0.04795837036046974
          },
          "paired_comparison": {
            "delta_incremental_turnover": {
              "unit": "RUB",
              "p10": 0.0,
              "p50": 0.0,
              "p90": 0.0
            },
            "probability_gt_zero": 0.0,
            "probability_noninferior": 1.0,
            "moved_budget_rub": null,
            "posterior_draws": 600
          }
        },
        {
          "scenario_id": "S02",
          "name": "Сценарий 2. Ровно по всем связкам",
          "description": "Общий бюджет кампании делится поровну между всеми исходными связками geo x channel.",
          "available": true,
          "budget": {
            "requested_budget_rub": 27373702.49,
            "allocated_budget_rub": 27373702.49,
            "unallocated_budget_rub": 0.0
          },
          "metrics": {
            "incremental_turnover": {
              "unit": "RUB",
              "p10": 95082454.813814,
              "p50": 98359342.856383,
              "p90": 101992123.154515
            },
            "turnover_roas": {
              "unit": "ratio",
              "p10": 3.473496,
              "p50": 3.593206,
              "p90": 3.725916
            },
            "incremental_orders": {
              "unit": "orders",
              "p10": 2276.04322,
              "p50": 3098.671018,
              "p90": 3919.559115
            },
            "incremental_orders_usage": "diagnostic_only",
            "avg_basket_turnover_bridge": {
              "unit": "turnover_bridge_from_avg_basket_rub",
              "p10": 80895463.192675,
              "p50": 83270176.893543,
              "p90": 85552039.72289
            }
          },
          "calculation_status": {
            "code": "calculated",
            "display_text": "Рассчитано"
          },
          "cell_support_status": {
            "code": "above_robust_upper",
            "display_text": "Вне надежной наблюдаемой зоны"
          },
          "optimizer_status": {
            "code": "no_safe_candidate",
            "display_text": "Только ручное распределение"
          },
          "support": {
            "elevated_warnings": 64,
            "strong_warnings": 22,
            "hard_warnings": 348,
            "policy_violations": 609
          },
          "quality": {
            "status": {
              "code": "not_for_automatic_reallocation",
              "display_text": "Не использовать для автоматического перераспределения"
            },
            "explanation": "Прогноз рассчитан, но хотя бы одна geo x channel ячейка выше robust observed upper. Это не запрет кампании: автоматическое перераспределение блокируется, медиаплан проверяется вручную.",
            "coverage_share": 1.0,
            "uncertainty_width_share": 0.0702492324576686
          },
          "paired_comparison": {
            "delta_incremental_turnover": {
              "unit": "RUB",
              "p10": 10558608.985062,
              "p50": 13784592.346255,
              "p90": 17457488.250412
            },
            "probability_gt_zero": 1.0,
            "probability_noninferior": 1.0,
            "moved_budget_rub": null,
            "posterior_draws": 600
          }
        },
        {
          "scenario_id": "S03",
          "name": "Сценарий 3. Каналы как были, гео ровно",
          "description": "Сохраняем бюджет каждого канала, но внутри канала делим его поровну между его гео.",
          "available": true,
          "budget": {
            "requested_budget_rub": 27373702.49,
            "allocated_budget_rub": 27373702.49,
            "unallocated_budget_rub": 0.0
          },
          "metrics": {
            "incremental_turnover": {
              "unit": "RUB",
              "p10": 78375585.902149,
              "p50": 81474639.095295,
              "p90": 84912150.663255
            },
            "turnover_roas": {
              "unit": "ratio",
              "p10": 2.863171,
              "p50": 2.976384,
              "p90": 3.101961
            },
            "incremental_orders": {
              "unit": "orders",
              "p10": 1651.600157,
              "p50": 2768.3954,
              "p90": 4448.661234
            },
            "incremental_orders_usage": "diagnostic_only",
            "avg_basket_turnover_bridge": {
              "unit": "turnover_bridge_from_avg_basket_rub",
              "p10": 61219812.803127,
              "p50": 62868440.983864,
              "p90": 64399328.991982
            }
          },
          "calculation_status": {
            "code": "calculated",
            "display_text": "Рассчитано"
          },
          "cell_support_status": {
            "code": "above_robust_upper",